{"$schema":"../../../schemas/nidl/0.1/interface.schema.json","compatibility":{"policy":"exact-version-during-0.x"},"errors":[{"id":8193,"name":"DESTINATION_UNREACHABLE"},{"id":8194,"name":"UNKNOWN_FLOW"},{"id":8195,"name":"BACKPRESSURE"}],"events":[{"data":"FlowPayloadDelivered","emitted_by":"provider","id":4097,"name":"flow-payload-delivered"},{"data":"FlowClosed","emitted_by":"provider","id":4098,"name":"flow-closed"}],"interface":{"id":"NOVA-IF-R-O","kind":"stratum-interface","name":"R-Stratum to O-Stratum Interface","status":"experimental","version":"0.1.0"},"invariants":[{"id":"RO-INV-001","statement":"O-Stratum does not depend on P-Stratum interfaces or integrations."}],"nidl":"0.1","operations":[{"caller":"consumer","errors":["DESTINATION_UNREACHABLE"],"id":1,"input":"OpenFlowRequest","name":"open-flow","success":"FlowOpened"},{"caller":"consumer","errors":["UNKNOWN_FLOW","BACKPRESSURE"],"id":2,"input":"SubmitFlowPayloadRequest","name":"submit-flow-payload","success":"FlowPayloadAccepted"}],"roles":{"consumer":"O-Stratum","provider":"R-Stratum"},"types":{"FlowId":{"kind":"opaque"},"OnerariiPayload":{"kind":"bytes"}}}
