{"$schema":"../../../schemas/nidl/0.1/interface.schema.json","compatibility":{"policy":"exact-version-during-0.x"},"errors":[{"id":8193,"name":"UNSUPPORTED_CONFIGURATION"},{"id":8194,"name":"UNKNOWN_PROVIDER_PATH"},{"id":8195,"name":"BACKPRESSURE"}],"events":[{"data":"ProviderPathAdded","emitted_by":"provider","id":4097,"name":"provider-path-added"},{"data":"ProviderPathUpdated","emitted_by":"provider","id":4098,"name":"provider-path-updated"},{"data":"ProviderPathRemoved","emitted_by":"provider","id":4099,"name":"provider-path-removed"},{"data":"ProviderSduReceived","emitted_by":"provider","id":4100,"name":"provider-sdu-received"}],"interface":{"id":"NOVA-IF-P-PATH-PROVIDER","kind":"provider-interface","name":"P-Stratum Path Provider Interface","status":"experimental","version":"0.2.0"},"invariants":[{"id":"PPP-INV-001","statement":"P-Stratum common treats P-0AP, P-LAP, and P-RAP as Path Providers and does not depend on their private behavior."},{"id":"PPP-INV-002","statement":"A provider does not expose provider-specific technology, locator, simulation, or control details through this Interface."},{"id":"PPP-INV-003","statement":"A provider-sdu-received event refers to exactly one active provider Path generation."}],"nidl":"0.1","operations":[{"caller":"consumer","errors":["UNSUPPORTED_CONFIGURATION"],"id":1,"input":"ActivateProviderRequest","name":"activate-provider","success":"ProviderActivated"},{"caller":"consumer","errors":["UNKNOWN_PROVIDER_PATH","BACKPRESSURE"],"id":2,"input":"SendProviderSduRequest","name":"send-provider-sdu","success":"ProviderSubmissionAccepted"},{"caller":"consumer","id":3,"input":"DeactivateProviderRequest","name":"deactivate-provider","success":"ProviderDeactivated"}],"roles":{"consumer":"P-Stratum common","provider":"P-0AP, P-LAP, or P-RAP"},"types":{"PathCandidate":{"kind":"structure"},"ProviderPathId":{"kind":"opaque"},"ProviderSdu":{"kind":"bytes"}}}
