{"$schema":"../../../schemas/nidl/0.1/interface.schema.json","compatibility":{"policy":"exact-version-during-0.x"},"errors":[{"id":8193,"name":"EGRESS_UNAVAILABLE"},{"id":8194,"name":"POLICY_DENIED"}],"events":[{"data":"ReturnIpDatagram","emitted_by":"provider","id":4097,"name":"return-ip-datagram"}],"interface":{"id":"NOVA-IF-IP-GATEWAY-EGRESS","kind":"gateway-egress-interface","name":"IP Gateway Egress Interface","status":"experimental","version":"0.1.0"},"invariants":[{"id":"IGE-INV-001","statement":"Gateway egress behavior is separate from end-host Platform Attachment behavior."}],"nidl":"0.1","operations":[{"caller":"consumer","errors":["EGRESS_UNAVAILABLE","POLICY_DENIED"],"id":1,"input":"ForwardIpDatagramRequest","name":"forward-ip-datagram","success":"IpDatagramForwarded"}],"roles":{"consumer":"IP-over-Nova Gateway","provider":"IP Gateway Egress"},"types":{"IpDatagram":{"kind":"bytes"}}}
