{"$schema":"../../../schemas/nidl/0.1/interface.schema.json","capabilities":[{"id":1,"name":"MESSAGE_BOUNDARIES"},{"id":2,"name":"RELIABLE_DELIVERY"},{"id":3,"name":"ORDERED_DELIVERY"},{"id":4,"name":"CONGESTION_CONTROL"},{"id":5,"name":"LOCATOR_MIGRATION"},{"id":6,"name":"UNRELIABLE_DATAGRAM"}],"compatibility":{"policy":"exact-version-during-0.x"},"errors":[{"id":8193,"name":"UNSUPPORTED_LOCATOR"},{"id":8194,"name":"UNREACHABLE"},{"id":8195,"name":"AUTHENTICATION_FAILED"},{"id":8196,"name":"UNKNOWN_BINDING_INSTANCE"},{"id":8197,"name":"UNIT_TOO_LARGE"},{"id":8198,"name":"BACKPRESSURE"}],"events":[{"data":"ReceivedUnit","emitted_by":"provider","id":4097,"name":"unit-received"},{"data":"BindingPropertiesChanged","emitted_by":"provider","id":4098,"name":"binding-properties-changed"},{"data":"BindingFailure","emitted_by":"provider","id":4099,"name":"binding-instance-failed"},{"data":"RemoteLocatorChanged","emitted_by":"provider","id":4100,"name":"remote-locator-changed"}],"interface":{"id":"NOVA-IF-P-RAP-BINDING","kind":"binding-interface","name":"P-RAP Binding Interface","status":"experimental","version":"0.1.0"},"invariants":[{"id":"PRB-INV-001","statement":"A Binding carries P-RAP units and does not define the P-RAP Association identity."},{"id":"PRB-INV-002","statement":"A Binding name identifies the integrated network and transport combination."},{"id":"PRB-INV-003","statement":"A unit accepted for transmission belongs to exactly one active Binding instance."}],"nidl":"0.1","operations":[{"caller":"consumer","errors":["UNSUPPORTED_LOCATOR","UNREACHABLE","AUTHENTICATION_FAILED"],"id":1,"input":"OpenBindingRequest","name":"open-binding-instance","success":"BindingOpened"},{"caller":"consumer","errors":["UNKNOWN_BINDING_INSTANCE","UNIT_TOO_LARGE","BACKPRESSURE"],"id":2,"input":"SendUnitRequest","name":"send-unit","success":"UnitAccepted"},{"caller":"consumer","id":3,"input":"CloseBindingRequest","name":"close-binding-instance","success":"BindingClosed"}],"roles":{"consumer":"P-RAP","provider":"P-RAP Binding"},"types":{"BindingId":{"bits":16,"kind":"unsigned-integer"},"BindingInstanceId":{"bits":64,"kind":"unsigned-integer"},"BindingProperties":{"kind":"structure","required_fields":["message_boundaries_preserved","reliable","ordered","congestion_controlled","effective_maximum_unit_size"]},"PrapUnit":{"kind":"bytes"},"RemoteLocator":{"kind":"tagged-opaque"}}}
