{"$schema":"../../../schemas/nidl/0.1/interface.schema.json","capabilities":[{"id":1,"name":"VIRTUAL_CLOCK"},{"id":2,"name":"SEEDED_RANDOM"},{"id":3,"name":"RECORD_REPLAY"},{"id":4,"name":"FAULT_INJECTION"},{"id":5,"name":"BIDIRECTIONAL_LINKS"},{"id":6,"name":"DIRECTIONAL_LINKS"}],"compatibility":{"policy":"exact-version-during-0.x"},"errors":[{"id":8193,"name":"INVALID_CONFIGURATION"},{"id":8194,"name":"UNSUPPORTED_VERSION"},{"id":8195,"name":"RESOURCE_LIMIT"},{"id":8196,"name":"DUPLICATE_ENDPOINT"},{"id":8197,"name":"UNKNOWN_ENDPOINT"},{"id":8198,"name":"INVALID_STATE"},{"id":8199,"name":"INVALID_LINK"},{"id":8200,"name":"UNKNOWN_LINK"},{"id":8201,"name":"UNIT_TOO_LARGE"},{"id":8202,"name":"BACKPRESSURE"},{"id":8203,"name":"INVALID_TIME"},{"id":8204,"name":"EVENT_LIMIT"},{"id":8205,"name":"TRACE_DISABLED"}],"events":[{"data":"FabricUnitDelivered","emitted_by":"provider","id":4097,"name":"unit-delivered"},{"data":"FabricLinkStateChanged","emitted_by":"provider","id":4098,"name":"link-state-changed"},{"data":"FabricFailure","emitted_by":"provider","id":4099,"name":"fabric-failed"}],"interface":{"id":"NOVA-IF-VIRTUAL-FABRIC","kind":"provider-interface","name":"Deterministic Virtual Fabric Interface","status":"experimental","version":"0.1.0"},"invariants":[{"id":"VF-INV-001","statement":"A fixed scenario, seed, scheduler policy, pseudo-random algorithm, and implementation version produce the same externally observable trace."},{"id":"VF-INV-002","statement":"The engine does not interpret R-Stratum, P-Stratum, P-LAP, or P-RAP protocol semantics."},{"id":"VF-INV-003","statement":"Every accepted unit is delivered, dropped, duplicated, or retained only according to explicit modeled state and deterministic scheduling."}],"nidl":"0.1","operations":[{"caller":"consumer","errors":["INVALID_CONFIGURATION","UNSUPPORTED_VERSION","RESOURCE_LIMIT"],"id":1,"input":"InitializeFabricRequest","name":"initialize-fabric","success":"FabricInitialized"},{"caller":"consumer","errors":["DUPLICATE_ENDPOINT","RESOURCE_LIMIT","INVALID_STATE"],"id":2,"input":"RegisterEndpointRequest","name":"register-endpoint","success":"EndpointRegistered"},{"caller":"consumer","errors":["UNKNOWN_ENDPOINT","INVALID_STATE"],"id":3,"input":"RemoveEndpointRequest","name":"remove-endpoint","success":"EndpointRemoved"},{"caller":"consumer","errors":["UNKNOWN_ENDPOINT","INVALID_LINK","RESOURCE_LIMIT","INVALID_STATE"],"id":4,"input":"ConfigureLinkRequest","name":"configure-link","success":"LinkConfigured"},{"caller":"consumer","errors":["UNKNOWN_LINK","INVALID_STATE"],"id":5,"input":"RemoveLinkRequest","name":"remove-link","success":"LinkRemoved"},{"caller":"consumer","errors":["UNKNOWN_ENDPOINT","UNKNOWN_LINK","UNIT_TOO_LARGE","BACKPRESSURE","INVALID_STATE"],"id":6,"input":"SubmitFabricUnitRequest","name":"submit-unit","success":"FabricUnitAccepted"},{"caller":"consumer","errors":["INVALID_TIME","EVENT_LIMIT","INVALID_STATE"],"id":7,"input":"AdvanceFabricTimeRequest","name":"advance-time","success":"FabricTimeAdvanced"},{"caller":"consumer","errors":["EVENT_LIMIT","INVALID_STATE"],"id":8,"input":"RunFabricUntilIdleRequest","name":"run-until-idle","success":"FabricIdle"},{"caller":"consumer","errors":["TRACE_DISABLED","RESOURCE_LIMIT"],"id":9,"input":"ExportFabricTraceRequest","name":"export-trace","success":"FabricTraceExported"}],"roles":{"consumer":"Simulation front end","provider":"Virtual Fabric engine"},"states":["STOPPED","READY","RUNNING","FAILED"],"types":{"FabricEndpointId":{"kind":"opaque"},"FabricLinkId":{"kind":"opaque"},"FabricLinkProperties":{"kind":"structure"},"FabricUnit":{"kind":"bytes"},"VirtualTime":{"kind":"unsigned-integer"}}}
