{"$schema":"../../../schemas/nidl/0.1/interface.schema.json","compatibility":{"policy":"exact-version-during-0.x"},"errors":[{"id":8193,"name":"UNSUPPORTED_PROFILE"},{"id":8194,"name":"UNKNOWN_ENDPOINT"},{"id":8195,"name":"BACKPRESSURE"}],"events":[{"data":"MessageReceived","emitted_by":"provider","id":4097,"name":"message-received"},{"data":"EndpointClosed","emitted_by":"provider","id":4098,"name":"endpoint-closed"}],"interface":{"id":"NOVA-IF-O-A","kind":"stratum-interface","name":"O-Stratum to Application Interface","status":"experimental","version":"0.1.0"},"invariants":[{"id":"OA-INV-001","statement":"Applications and Compatibility Services do not access P-Stratum or R-Stratum internals."}],"nidl":"0.1","operations":[{"caller":"consumer","errors":["UNSUPPORTED_PROFILE"],"id":1,"input":"OpenEndpointRequest","name":"open-endpoint","success":"EndpointOpened"},{"caller":"consumer","errors":["UNKNOWN_ENDPOINT","BACKPRESSURE"],"id":2,"input":"SendMessageRequest","name":"send-message","success":"MessageAccepted"}],"roles":{"consumer":"Application or Compatibility Service","provider":"O-Stratum"},"types":{"ApplicationEndpointId":{"kind":"opaque"},"Message":{"kind":"bytes"}}}
