{"$schema":"../../../schemas/nidl/0.1/interface.schema.json","capabilities":[{"id":1,"name":"LOOPBACK_MODE"},{"id":2,"name":"PAIRED_NODE_MODE"},{"id":3,"name":"VIRTUAL_FABRIC_MODE"},{"id":4,"name":"RECORD_REPLAY"},{"id":5,"name":"ADVERSARIAL_PROVIDER_MODE"}],"compatibility":{"policy":"exact-version-during-0.x"},"errors":[{"id":8193,"name":"INVALID_SCENARIO"},{"id":8194,"name":"UNSUPPORTED_SCENARIO_VERSION"},{"id":8195,"name":"RESOURCE_LIMIT"},{"id":8196,"name":"DUPLICATE_NODE"},{"id":8197,"name":"UNKNOWN_NODE"},{"id":8198,"name":"INVALID_STATE"},{"id":8199,"name":"DUPLICATE_PATH"},{"id":8200,"name":"UNKNOWN_PATH"},{"id":8201,"name":"INVALID_PATH_KIND"},{"id":8202,"name":"INVALID_CHARACTERISTICS"},{"id":8203,"name":"INVALID_TIME"},{"id":8204,"name":"EVENT_LIMIT"},{"id":8205,"name":"NO_RECORDING"},{"id":8206,"name":"INVALID_TRACE"},{"id":8207,"name":"UNSUPPORTED_TRACE_VERSION"},{"id":8208,"name":"REPLAY_INCOMPATIBLE"},{"id":8209,"name":"INVALID_MODE"}],"events":[{"data":"ControlActionApplied","emitted_by":"provider","id":4097,"name":"control-action-applied"},{"data":"SimulationFailure","emitted_by":"provider","id":4098,"name":"simulation-failed"},{"data":"TraceAvailable","emitted_by":"provider","id":4099,"name":"trace-available"}],"interface":{"id":"NOVA-IF-P-0AP-CONTROL","kind":"provider-interface","name":"P-0AP Control Interface","status":"experimental","version":"0.1.0"},"invariants":[{"id":"P0C-INV-001","statement":"Control operations and identifiers are not exposed through NOVA-IF-P-R or NOVA-IF-P-PATH-PROVIDER."},{"id":"P0C-INV-002","statement":"Paired-node and Virtual Fabric modes use distinct Nova Node identities for distinct simulated Nodes."},{"id":"P0C-INV-003","statement":"Adversarial provider mode is explicitly selected and clearly labeled as non-conforming provider behavior."}],"nidl":"0.1","operations":[{"caller":"consumer","errors":["INVALID_SCENARIO","UNSUPPORTED_SCENARIO_VERSION","RESOURCE_LIMIT"],"id":1,"input":"LoadScenarioRequest","name":"load-scenario","success":"ScenarioLoaded"},{"caller":"consumer","errors":["DUPLICATE_NODE","RESOURCE_LIMIT","INVALID_STATE"],"id":2,"input":"CreateNodeRequest","name":"create-node","success":"NodeCreated"},{"caller":"consumer","errors":["UNKNOWN_NODE","INVALID_STATE"],"id":3,"input":"RemoveNodeRequest","name":"remove-node","success":"NodeRemoved"},{"caller":"consumer","errors":["UNKNOWN_NODE","DUPLICATE_PATH","INVALID_PATH_KIND","RESOURCE_LIMIT","INVALID_STATE"],"id":4,"input":"CreatePathRequest","name":"create-path","success":"PathCreated"},{"caller":"consumer","errors":["UNKNOWN_PATH","INVALID_CHARACTERISTICS","INVALID_STATE"],"id":5,"input":"UpdatePathRequest","name":"update-path","success":"PathUpdated"},{"caller":"consumer","errors":["UNKNOWN_PATH","INVALID_STATE"],"id":6,"input":"RemovePathRequest","name":"remove-path","success":"PathRemoved"},{"caller":"consumer","errors":["UNKNOWN_NODE","INVALID_STATE"],"id":7,"input":"SetPartitionRequest","name":"set-partition","success":"PartitionApplied"},{"caller":"consumer","errors":["INVALID_TIME","INVALID_STATE"],"id":8,"input":"AdvanceTimeRequest","name":"advance-time","success":"TimeAdvanced"},{"caller":"consumer","errors":["EVENT_LIMIT","INVALID_STATE"],"id":9,"input":"RunUntilIdleRequest","name":"run-until-idle","success":"SimulationIdle"},{"caller":"consumer","errors":["INVALID_STATE","RESOURCE_LIMIT"],"id":10,"input":"StartRecordingRequest","name":"start-recording","success":"RecordingStarted"},{"caller":"consumer","errors":["NO_RECORDING","RESOURCE_LIMIT"],"id":11,"input":"ExportTraceRequest","name":"export-trace","success":"TraceExported"},{"caller":"consumer","errors":["INVALID_TRACE","UNSUPPORTED_TRACE_VERSION","REPLAY_INCOMPATIBLE","RESOURCE_LIMIT"],"id":12,"input":"ReplayTraceRequest","name":"replay-trace","success":"TraceReplayed"},{"caller":"consumer","errors":["INVALID_MODE","INVALID_STATE"],"id":13,"input":"SetProviderComplianceModeRequest","name":"set-provider-compliance-mode","success":"ProviderComplianceModeSet"}],"roles":{"consumer":"Simulation controller","provider":"P-0AP"},"states":["INACTIVE","READY","RUNNING","FAILED"],"types":{"PathCharacteristics":{"kind":"structure"},"ScenarioDocument":{"kind":"structure"},"SimulationNodeId":{"kind":"opaque"},"SimulationPathId":{"kind":"opaque"},"TraceDocument":{"kind":"structure"}}}
