{"$schema":"../../../schemas/nidl/0.1/interface.schema.json","compatibility":{"policy":"exact-version-during-0.x"},"errors":[{"id":8193,"name":"UNSUPPORTED_FACILITY"}],"events":[{"data":"FacilityResult","emitted_by":"provider","id":4097,"name":"facility-result"}],"interface":{"id":"NOVA-IF-R-FACILITY","kind":"facility-interface","name":"R-Stratum Facility Interface","status":"experimental","version":"0.1.0"},"invariants":[{"id":"RF-INV-001","statement":"A facility is replaceable and communicates with R-Stratum core only through this contract."}],"nidl":"0.1","operations":[{"caller":"consumer","errors":["UNSUPPORTED_FACILITY"],"id":1,"input":"ActivateFacilityRequest","name":"activate-facility","success":"FacilityActivated"}],"roles":{"consumer":"R-Stratum core","provider":"R-Stratum Facility"},"types":{"FacilityId":{"kind":"opaque"}}}
