{"$schema":"../../../schemas/nidl/0.1/interface.schema.json","compatibility":{"policy":"exact-version-during-0.x"},"errors":[{"id":8193,"name":"PERMISSION_DENIED"},{"id":8194,"name":"UNSUPPORTED_PLATFORM"},{"id":8195,"name":"UNKNOWN_INTERFACE"},{"id":8196,"name":"INVALID_MTU"},{"id":8197,"name":"BACKPRESSURE"},{"id":8198,"name":"INVALID_ROUTE"}],"events":[{"data":"IpDatagramReceived","emitted_by":"provider","id":4097,"name":"ip-datagram-received"},{"data":"PlatformInterfaceFailure","emitted_by":"provider","id":4098,"name":"platform-interface-failed"},{"data":"PlatformMtuChanged","emitted_by":"provider","id":4099,"name":"platform-mtu-changed"}],"interface":{"id":"NOVA-IF-IP-PLATFORM-ATTACHMENT","kind":"platform-attachment-interface","name":"IP Platform Attachment Interface","status":"experimental","version":"0.1.0"},"invariants":[{"id":"IPA-INV-001","statement":"A Platform Attachment exchanges IP datagrams and host configuration only; it does not implement Nova routing."}],"nidl":"0.1","operations":[{"caller":"consumer","errors":["PERMISSION_DENIED","UNSUPPORTED_PLATFORM"],"id":1,"input":"CreateInterfaceRequest","name":"create-interface","success":"InterfaceCreated"},{"caller":"consumer","errors":["UNKNOWN_INTERFACE","INVALID_MTU"],"id":2,"input":"SetMtuRequest","name":"set-mtu","success":"MtuSet"},{"caller":"consumer","errors":["UNKNOWN_INTERFACE","BACKPRESSURE"],"id":3,"input":"InjectIpDatagramRequest","name":"inject-ip-datagram","success":"IpDatagramAccepted"},{"caller":"consumer","errors":["UNKNOWN_INTERFACE","INVALID_ROUTE"],"id":4,"input":"AddRouteRequest","name":"add-route","success":"RouteAdded"}],"roles":{"consumer":"IP-over-Nova Compatibility Service","provider":"IP Platform Attachment"},"types":{"IpDatagram":{"kind":"bytes","maximum_length":65535},"IpVersion":{"kind":"enumeration","values":["IPV4","IPV6"]},"PlatformInterfaceId":{"kind":"opaque"}}}
