{"$schema":"../../../schemas/nidl/0.1/interface.schema.json","capabilities":[{"id":1,"name":"RELIABLE_SDU"},{"id":2,"name":"UNRELIABLE_SDU"},{"id":3,"name":"PATH_CHARACTERISTICS"}],"compatibility":{"policy":"exact-version-during-0.x","unknown_optional_fields":"ignore"},"errors":[{"id":8193,"name":"UNSUPPORTED_VERSION"},{"id":8194,"name":"UNKNOWN_PATH"},{"id":8195,"name":"PATH_UNAVAILABLE"},{"id":8196,"name":"SDU_TOO_LARGE"},{"id":8197,"name":"BACKPRESSURE"},{"id":8198,"name":"UNKNOWN_SUBMISSION"},{"id":8199,"name":"TOO_LATE"}],"events":[{"data":"PathAdded","emitted_by":"provider","id":4097,"name":"path-added"},{"data":"PathUpdated","emitted_by":"provider","id":4098,"name":"path-updated"},{"data":"PathRemoved","emitted_by":"provider","id":4099,"name":"path-removed"},{"data":"SduDelivered","emitted_by":"provider","id":4100,"name":"sdu-delivered"},{"data":"SubmissionResult","emitted_by":"provider","id":4101,"name":"submission-result"}],"interface":{"id":"NOVA-IF-P-R","kind":"stratum-interface","name":"P-Stratum to R-Stratum Interface","status":"experimental","version":"0.1.0"},"invariants":[{"id":"PR-INV-001","statement":"R-Stratum shall not require knowledge of P-LAP, P-RAP, any Adapter, or any Binding."},{"id":"PR-INV-002","statement":"An SDU is delivered with its PeerId and PathId and preserves its logical boundary."},{"id":"PR-INV-003","statement":"No SDU is delivered on a Path after path-removed for that Path generation."}],"nidl":"0.1","operations":[{"caller":"consumer","errors":["UNSUPPORTED_VERSION"],"id":1,"input":"OpenInterfaceRequest","name":"open-interface","success":"InterfaceOpened"},{"caller":"consumer","errors":["UNKNOWN_PATH","PATH_UNAVAILABLE","SDU_TOO_LARGE","BACKPRESSURE"],"id":2,"input":"SubmitSduRequest","name":"submit-sdu","success":"SubmissionAccepted"},{"caller":"consumer","errors":["UNKNOWN_SUBMISSION","TOO_LATE"],"id":3,"input":"CancelSubmissionRequest","name":"cancel-submission","success":"SubmissionCancelled"},{"caller":"consumer","errors":["UNKNOWN_PATH"],"id":4,"input":"QueryPathRequest","name":"query-path","success":"PathSnapshot"}],"roles":{"consumer":"R-Stratum","provider":"P-Stratum"},"types":{"PathId":{"bits":64,"kind":"unsigned-integer"},"PathKind":{"kind":"enumeration","values":["LINK_ADJACENT","REMOTE_ASSOCIATION"]},"PathProperties":{"description":"Abstract measurable and declared Path properties; no Adapter or Binding identifiers.","kind":"structure"},"PeerId":{"kind":"opaque-bytes","length":32},"Sdu":{"kind":"bytes"}}}
