{"$schema":"../../../schemas/nidl/0.1/interface.schema.json","capabilities":[{"id":1,"name":"BROADCAST"},{"id":2,"name":"MULTICAST"},{"id":3,"name":"POINT_TO_POINT"},{"id":4,"name":"CONGESTION_SIGNAL"}],"compatibility":{"policy":"exact-version-during-0.x"},"errors":[{"id":8193,"name":"UNSUPPORTED_NEXUS"},{"id":8194,"name":"PERMISSION_DENIED"},{"id":8195,"name":"ADAPTER_INACTIVE"},{"id":8196,"name":"FRAME_TOO_LARGE"},{"id":8197,"name":"BACKPRESSURE"}],"events":[{"data":"FrameReceived","emitted_by":"provider","id":4097,"name":"frame-received"},{"data":"AdapterPropertiesChanged","emitted_by":"provider","id":4098,"name":"adapter-properties-changed"},{"data":"AdapterFailure","emitted_by":"provider","id":4099,"name":"adapter-failed"}],"interface":{"id":"NOVA-IF-P-LAP-ADAPTER","kind":"adapter-interface","name":"P-LAP Adapter Interface","status":"experimental","version":"0.1.0"},"invariants":[{"id":"PLA-INV-001","statement":"An Adapter exposes Nexus Fundamenta behavior and does not implement R-Stratum routing."},{"id":"PLA-INV-002","statement":"P-LAP does not assume one concrete Nexus locator format."}],"nidl":"0.1","operations":[{"caller":"consumer","errors":["UNSUPPORTED_NEXUS","PERMISSION_DENIED"],"id":1,"input":"ActivateAdapterRequest","name":"activate-adapter","success":"AdapterActivated"},{"caller":"consumer","errors":["ADAPTER_INACTIVE","FRAME_TOO_LARGE","BACKPRESSURE"],"id":2,"input":"SendFrameRequest","name":"send-frame","success":"FrameAccepted"},{"caller":"consumer","id":3,"input":"DeactivateAdapterRequest","name":"deactivate-adapter","success":"AdapterDeactivated"}],"roles":{"consumer":"P-LAP","provider":"P-LAP Adapter"},"types":{"AdapterFrame":{"kind":"bytes"},"AdapterId":{"bits":64,"kind":"unsigned-integer"},"AdapterProperties":{"kind":"structure"},"NexusLocator":{"kind":"opaque-bytes"}}}
